<?xml version="1.0" encoding="UTF-8"?>
<!--Sample XML file generated by XMLSpy v2024 rel. 2 sp1 (x64) (http://www.altova.com)-->
<AdcSalInvoicesGenerated xmlns:xsi="http://www.w3.org/2001/XMLSchema-instance" xmlns="http://schemas.iso.org/AdcsML/Messages/AdcSalInvoicesGenerated-v1" xsi:schemaLocation="http://schemas.iso.org/AdcsML/Messages/AdcSalInvoicesGenerated-v1 AdcSalInvoicesGenerated-v1.0.xsd">
	<SalInvoiGen>
		<InvoiId>a</InvoiId>
		<InvoiNr>a</InvoiNr>
		<FiscYr>0000</FiscYr>
		<AcntingPer>a</AcntingPer>
		<OfficialInvoiCd>a</OfficialInvoiCd>
		<InvoiTypNm>a</InvoiTypNm>
		<InvoiDt>1957-08-13</InvoiDt>
		<InvoiDueDt>1957-08-13</InvoiDueDt>
		<CustAcntId>a</CustAcntId>
		<SetlMthdCd>a</SetlMthdCd>
		<InvoiTrAmt>0</InvoiTrAmt>
		<InvoiTrCurCd>aaa</InvoiTrCurCd>
		<PayTermCd>a</PayTermCd>
		<TrmsDscntPerc>0</TrmsDscntPerc>
		<TrmsDscntDays>0</TrmsDscntDays>
		<TrmsDueDays>0</TrmsDueDays>
		<GrpCd>a</GrpCd>
		<Stat>a</Stat>
		<Rmrk>a</Rmrk>
		<Tax>
			<TaxTypCd>VAT-SS</TaxTypCd>
			<TaxTrAmt>10</TaxTrAmt>
		</Tax>
		<Tax>
			<TaxTypCd>VAT-A</TaxTypCd>
			<TaxTrAmt>8</TaxTrAmt>
		</Tax>
		<Tax>
			<TaxTypCd>VAT-E</TaxTypCd>
			<TaxTrAmt>0</TaxTrAmt>
		</Tax>
		<Tax>
			<TaxTypCd>VAT-O</TaxTypCd>
			<TaxTrAmt>0</TaxTrAmt>
		</Tax>
		<Crea>
			<UserId>a</UserId>
			<Dt>1957-08-13</Dt>
			<Tm>09:30:47+05:00</Tm>
		</Crea>
		<Aprv>
			<UserId>a</UserId>
			<Dt>1957-08-13</Dt>
			<Tm>09:30:47+05:00</Tm>
		</Aprv>
		<LstMdf>
			<UserId>a</UserId>
			<Dt>1957-08-13</Dt>
			<Tm>09:30:47+05:00</Tm>
		</LstMdf>
		<BusSg>
			<SqNr>a</SqNr>
			<BusSgCd>a</BusSgCd>
		</BusSg>
	</SalInvoiGen>
</AdcSalInvoicesGenerated>
